{
  "schemaVersion": "1.0",
  "runId": "example-synthetic-install",
  "operation": "INSTALL",
  "status": "SUCCESS",
  "state": "COMPLETE",
  "category": "SUCCESS",
  "versions": {
    "jbpa": "1.0.0-rc3",
    "requestedPA": "12.10",
    "resolvedPA": "12.10.1.1"
  },
  "artifact": {},
  "platform": {},
  "registration": {},
  "health": {},
  "enterpriseConfiguration": {},
  "error": null,
  "details": {
    "status": "COMPLETE",
    "exampleOnly": true
  }
}
